{
    "schema_version":  1,
    "benchmark":  "protocol-host-validation",
    "status":  "passed",
    "run_utc":  "2026-08-13T06:11:24.5943965Z",
    "source_revision":  "85d5c2b84b7cd493718c7ed7fcb98aa902d781f3",
    "requested_protocol":  "HTTP/2",
    "observed_protocol":  "HTTP/2",
    "mode":  "required",
    "external_network":  true,
    "target":  {
                   "scheme":  "https",
                   "host":  "nghttp2.org",
                   "port":  443
               },
    "bridge":  {
                   "name":  "xlflow-excel-bridge",
                   "version":  "1.0.0",
                   "runtime":  ".NET 8.0.30",
                   "architecture":  "X64"
               },
    "office":  {
                   "version":  "16.0",
                   "build":  "17932",
                   "operating_system":  "Windows (64-bit) NT 10.00"
               },
    "environment":  {
                        "windows":  "Microsoft Windows NT 10.0.22631.0",
                        "winhttp":  {
                                        "enabled_protocol_option":  133,
                                        "used_protocol_option":  134,
                                        "required_protocol_option":  145,
                                        "observed_protocol":  "HTTP/2"
                                    }
                    },
    "artifact":  {
                     "name":  "VBA-HTTP.xlsm",
                     "sha256":  "33dbe4adc9937b6ec25cf72cceff6eedb99f99384745c8e680d66c48ebe479c4",
                     "manifest_sha256":  "b5f53ea3a6523b5cfdf756984dcfb98d9271d574ca91a28d4a8c22807b7ec7b2"
                 },
    "build":  {
                  "vbe_compile":  "passed",
                  "source_applied":  true,
                  "workbook_saved":  true,
                  "workbook_closed":  true,
                  "excel_cleanup":  "clean"
              }
}
